"ID","Gemeinde_color","Ja_Stimmen_In_Prozent","Nein_Stimmen_In_Prozent","Gemeinde_de","Text_de"
3101,41.2,41.2,58.8,"Appenzell AI","58,8 Prozent der Stimmbürgerinnen und Stimmbürger von Appenzell sagen Nein zur Prämienentlastungsinitiative. Appenzell hat damit anders abgestimmt als der Kanton Appenzell Innerrhoden, der die Vorlage angenommen hat."
3102,73.2,73.2,26.8,"Gonten AI","73,2 Prozent der Abstimmenden in der Gemeinde Gonten haben Ja gesagt zur Prämienentlastungsinitiative. Gonten hat damit bei dieser Vorlage den höchsten Ja-Anteil im Kanton Appenzell Innerrhoden."
3104,39.8,39.8,60.2,"Schlatt-Haslen AI","In Schlatt-Haslen hat die Stimmbevölkerung die Prämienentlastungsinitiative abgelehnt. Das Volksbegehren wurde mit einem Nein-Stimmen-Anteil von 60,2 Prozent verworfen. Schlatt-Haslen hat damit bei dieser Vorlage den höchsten Nein-Anteil im Kanton Appenzell Innerrhoden."
3111,57.6,57.6,42.4,"Oberegg AI","In Oberegg hat die Stimmbevölkerung der Prämienentlastungsinitiative zugestimmt. Sie wurde mit einem Ja-Stimmen-Anteil von 57,6 Prozent angenommen. Oberegg hat damit gleich wie der Kanton Appenzell Innerrhoden Ja gesagt zu dieser Vorlage."
3112,46,46,54,"Schwende-Rüti AI","Schwende-Rüti hat die Prämienentlastungsinitiative mit 54 Prozent abgelehnt. Schwende-Rüti hat damit anders abgestimmt als der Kanton Appenzell Innerrhoden, der die Vorlage angenommen hat."
