"ID","Gemeinde_color","Ja_Stimmen_In_Prozent","Nein_Stimmen_In_Prozent","Gemeinde_de","Text_de"
3101,13.6,13.6,86.4,"Appenzell AI","86,4 Prozent der Stimmbürgerinnen und Stimmbürger von Appenzell sagen Nein zum Stromgesetz. Appenzell hat damit anders abgestimmt als der Kanton Appenzell Innerrhoden, der die Vorlage angenommen hat."
3102,45.3,45.3,54.7,"Gonten AI","Keine Mehrheit für das Stromgesetz in Gonten: Mit 7'308 Nein-Stimmen zu 6'045 Ja-Stimmen oder 54,7 Prozent hat die Gemeinde die Vorlage verworfen. Gonten hat damit anders abgestimmt als der Kanton Appenzell Innerrhoden, der die Vorlage angenommen hat."
3104,56.5,56.5,43.5,"Schlatt-Haslen AI","In Schlatt-Haslen hat die Stimmbevölkerung dem Stromgesetz zugestimmt. Die Vorlage wurde mit einem Ja-Stimmen-Anteil von 56,5 Prozent angenommen. Schlatt-Haslen hat damit bei dieser Vorlage den höchsten Ja-Anteil im Kanton Appenzell Innerrhoden."
3111,3.9,3.9,96.1,"Oberegg AI","In Oberegg hat die Stimmbevölkerung das Stromgesetz abgelehnt. Die Vorlage wurde mit einem Nein-Stimmen-Anteil von 96,1 Prozent verworfen. Oberegg hat damit bei dieser Vorlage den höchsten Nein-Anteil im Kanton Appenzell Innerrhoden."
3112,38.8,38.8,61.2,"Schwende-Rüti AI","Schwende-Rüti hat das Stromgesetz mit 61,2 Prozent abgelehnt. Schwende-Rüti hat damit anders abgestimmt als der Kanton Appenzell Innerrhoden, der die Vorlage angenommen hat."
