"ID","Gemeinde_color","Ja_Stimmen_In_Prozent","Nein_Stimmen_In_Prozent","Gemeinde_de","Text_de"
1401,64.8,64.8,35.2,"Alpnach OW","Ja zum Stromgesetz in Alpnach. Die Gemeinde hat die Vorlage mit 64,8 Prozent der Stimmen angenommen."
1402,66.6,66.6,33.4,"Engelberg OW","In Engelberg hat die Stimmbevölkerung dem Stromgesetz zugestimmt. Die Vorlage wurde mit einem Ja-Stimmen-Anteil von 66,6 Prozent angenommen."
1403,58,58,42,"Giswil OW","In Giswil hat die Stimmbevölkerung dem Stromgesetz zugestimmt. Die Vorlage wurde mit einem Ja-Stimmen-Anteil von 58 Prozent angenommen."
1404,56.1,56.1,43.9,"Kerns OW","56,1 Prozent der Abstimmenden in der Gemeinde Kerns haben Ja gesagt zum Stromgesetz."
1405,60.5,60.5,39.5,"Lungern OW","60,5 Prozent der Abstimmenden in der Gemeinde Lungern haben Ja gesagt zum Stromgesetz."
1406,65,65,35,"Sachseln OW","Ja zum Stromgesetz in Sachseln. Die Gemeinde hat die Vorlage mit 65 Prozent der Stimmen angenommen."
1407,50,0,0,"Sarnen OW","Die Resultate dieser Gemeinde sind noch nicht bekannt."
