"ID","Gemeinde_color","Ja_Stimmen_In_Prozent","Nein_Stimmen_In_Prozent","Gemeinde_de","Text_de"
1401,32.8,32.8,67.2,"Alpnach OW","Alpnach hat das Stromgesetz mit 67,2 Prozent abgelehnt. Alpnach hat damit anders abgestimmt als der Kanton Obwalden, der die Vorlage angenommen hat."
1402,39.6,39.6,60.4,"Engelberg OW","In Engelberg hat die Stimmbevölkerung das Stromgesetz abgelehnt. Die Vorlage wurde mit einem Nein-Stimmen-Anteil von 60,4 Prozent verworfen. Engelberg hat damit anders abgestimmt als der Kanton Obwalden, der die Vorlage angenommen hat."
1403,89.1,89.1,10.9,"Giswil OW","In Giswil hat die Stimmbevölkerung dem Stromgesetz zugestimmt. Die Vorlage wurde mit einem Ja-Stimmen-Anteil von 89,1 Prozent angenommen. Giswil hat damit bei dieser Vorlage den höchsten Ja-Anteil im Kanton Obwalden."
1404,46.8,46.8,53.2,"Kerns OW","Keine Mehrheit für das Stromgesetz in Kerns: Mit 8'313 Nein-Stimmen zu 7'309 Ja-Stimmen oder 53,2 Prozent hat die Gemeinde die Vorlage verworfen. Kerns hat damit anders abgestimmt als der Kanton Obwalden, der die Vorlage angenommen hat."
1405,38.3,38.3,61.7,"Lungern OW","Keine Mehrheit für das Stromgesetz in Lungern: Mit 4'279 Nein-Stimmen zu 2'660 Ja-Stimmen oder 61,7 Prozent hat die Gemeinde die Vorlage verworfen. Lungern hat damit anders abgestimmt als der Kanton Obwalden, der die Vorlage angenommen hat."
1406,62.9,62.9,37.1,"Sachseln OW","Ja zum Stromgesetz in Sachseln. Die Gemeinde hat die Vorlage mit 62,9 Prozent der Stimmen angenommen. Sachseln hat damit gleich wie der Kanton Obwalden Ja gesagt zu dieser Vorlage."
1407,9.3,9.3,90.7,"Sarnen OW","In Sarnen hat das Stromgesetz keine Mehrheit gefunden. Auf 90,7 Prozent der abgegebenen Stimmzettel stand ein Nein. Sarnen hat damit bei dieser Vorlage den höchsten Nein-Anteil im Kanton Obwalden."
